{
  "version": "1.0.0",
  "date": "2026-09-27",
  "status": "CONSOLIDATED_DESIGN_AUTHORITY",
  "human_approved": false,
  "production_authorized": false,
  "balance_status": "LOCKED_DESIGN_NOT_GAMEPLAY_VALIDATED",
  "note": "Consolidates owner-authorized design selections and latest placeholder-first workflow. This package was assembled for Codex migration; no Unity implementation or blanket execution/publishing approval is claimed.",
  "platform": "Android / Google Play",
  "engine_candidate": "Unity 6000.3.21f1 LTS",
  "orientation": "landscape",
  "language": "English",
  "offline_core": true,
  "player_accounts": false,
  "cloud_progression": false,
  "simulation_hz": 20,
  "render_fps_target": 60,
  "low_tier_render_fps": 30,
  "lane_length_m": 28,
  "base_fronts_m": [
    0,
    28
  ],
  "spawn_positions_m": [
    0.8,
    27.2
  ],
  "max_alive_units_per_side": 24,
  "max_melee_engagement_slots_per_side": 3,
  "ranged_fire_through_friendlies": true,
  "physics_damage": false,
  "supply": {
    "start": 100,
    "rate_per_s": 6,
    "cap": 200,
    "on_kill": 0,
    "deployment_cooldown_s": 0.3,
    "insufficient_funds": "reject without spend or queue",
    "cap_reached": "reject without spend"
  },
  "rally": {
    "attack_rate_bonus": 0.3,
    "duration_s": 5,
    "cooldown_s": 30,
    "initial_cooldown_s": 12,
    "affected": "all living friendly units including units spawned while active",
    "damage_bonus": 0,
    "cooldown_starts": "activation",
    "charges_sold": false
  },
  "battle": {
    "soft_time_limit_s": 150,
    "hard_time_limit_s": 210,
    "overtime": "After 150s, both sides deal 2x base damage; no troop damage or income change. At 210s compare base HP fractions; exact tie ends as DRAW, not win.",
    "simultaneous_base_destruction": "DRAW; no battle-win reward",
    "pause": "no simulation or economy advancement",
    "forced_app_stop": "restart current battle from saved prebattle checkpoint; previous battle rewards persist",
    "player_base_default_hp": 900,
    "enemy_rally": false,
    "enemy_policy": "FINITE_ORDERED_QUEUE",
    "enemy_orders_expire_at_s": 180,
    "base_attacks": false,
    "base_healing": false
  },
  "expedition": {
    "battles": 4,
    "draft_before_battles": [
      1,
      2,
      3,
      4
    ],
    "options_per_draft": 3,
    "selected_upgrades_max": 4,
    "same_upgrade_repeats": false,
    "free_rerolls_per_expedition": 1,
    "additional_rewarded_rerolls_per_expedition": 1,
    "loadout_locked": "from first draft until expedition ends",
    "equipped_units": 4,
    "base_and_supply_reset_each_battle": true,
    "run_duration_target_minutes": [
      8,
      12
    ]
  },
  "scope": {
    "units": 6,
    "upgrade_definitions": 24,
    "chapters": 3,
    "expeditions_per_chapter": 3,
    "encounter_configs": 36,
    "derived_boss_variants": 2,
    "backgrounds": 3,
    "core_views": 6,
    "iap_products": 2,
    "rewarded_placements": 2,
    "forced_ads": 0,
    "new_features_excluded": [
      "Play Games achievements",
      "Play Games cloud saves",
      "PvP",
      "account login",
      "ad mediation",
      "age evolution",
      "anti-cheat for local Medals",
      "asynchronous PvP",
      "battle pass",
      "civilization evolution",
      "cloud saves",
      "co-op",
      "daily login rewards",
      "daily quests",
      "downloadable content system",
      "dynamic difficulty",
      "energy",
      "equipment inventory",
      "extra factions",
      "extra lanes",
      "gacha",
      "guilds",
      "leaderboards",
      "live A/B tests",
      "loot boxes",
      "matchmaking",
      "multiplayer",
      "premium currency",
      "push notifications",
      "remote balance changes",
      "runtime AI calls",
      "server-authoritative combat",
      "shared economy",
      "subscriptions",
      "voiceover"
    ]
  },
  "design_lock_authorized": true,
  "balance_version": "B001",
  "toolchain_lock": "T001",
  "audience": "18+ intended; actual declarations must match finished product",
  "initial_production_countries": [
    "US",
    "GB",
    "CA",
    "AU",
    "NZ",
    "IE"
  ],
  "acquisition": "ORGANIC_ONLY",
  "new_cash_spend_authorized": 0,
  "visual_approval": "V001_STYLE_APPROVED_FINAL_EXECUTION_DEFERRED",
  "numeric_contract": {
    "coordinate_scale_per_metre": 1000000,
    "supply_scale_per_unit": 1000000,
    "percentage_scale": 10000,
    "integer_width_bits": 64,
    "simulation_tick_ms": 50,
    "damage_hp_rounding": "round positive half up once after additive modifier group; then flat reduction; minimum 1 for an eligible direct damage event",
    "cost_rounding": "ceiling after summed additive cost modifiers; minimum 1",
    "attack_period_ticks": "max(7, ceil(base_period_ticks * 10000 / (10000 + rate_bonus_bp)))",
    "windup_ticks": "min(period_ticks-1, max(1, ceil(base_windup_ticks * 10000 / (10000 + rate_bonus_bp))))",
    "clock_boundaries": "At tick t: expire effects; add income for elapsed interval; settle an owed bonus if a slot is free; validate queued player commands; enemy deployment; movement/attacks; collect due damage; simultaneous damage; deaths; victory; hard-timeout if unresolved. No income at tick0.",
    "timer_expiry": "Active for ticks start <= t < expiry. Overtime begins at tick 3000. No new enemy order at tick >=3600. Hard finish tick4200.",
    "movement_rounding": "velocity fixed-point units/second; carry numerator remainder across 20-Hz steps; reset remainder only on spawn",
    "supply_rounding": "fixed-point income with carried division remainder; no income at tick0; first at tick1",
    "range_measure": "edge-to-edge horizontal gap, max(0,abs(centerA-centerB)-halfwidthA-halfwidthB); base front is zero-width target",
    "flat_reduction_before_barrier": true,
    "barrier_activation": "on first positive post-mitigation incoming damage; grant barrier then absorb that same event; same-tick damage aggregate consumes one shield; never refresh",
    "enemy_funding": "Regenerating bank starts as listed, capped at200; lifetime committed spend cannot exceed queue budget; queue is never repeated.",
    "save_identity": "stable per-run/per-battle/per-reward IDs; UTC wall time never advances combat or income"
  },
  "formation_contract": {
    "engagement_slots_per_side": 3,
    "friendly_group_spacing_m": 0.65,
    "ranged_queue_spacing_m": 0.45,
    "slot_assignment": "retain living eligible incumbents; fill vacant slots with closest eligible melee, ties by spawn ID; reserves may not attack until assigned. No teleport to slot.",
    "unprotected_ranged": "targetable at nearest opposing frontage whether or not a melee slot is occupied; continues its ordinary ranged attack if an eligible target is in range",
    "target_selection": "nearest opposing reachable centre by forward X distance then spawn ID; several attackers may target the same enemy; no invisible one-to-one pairing",
    "base_attack_blocking": "an opposing live body between attacker and base blocks base targeting regardless of whether it is in a melee slot",
    "crossing": "friendly ranged/melee may pass; opposing bodies cannot cross; resolve simultaneous approaching movement proportionally to proposed distances, with spawn-ID residual tie-break",
    "range_tolerance_m": 1e-06,
    "ranged_retreat": false,
    "crowding": "three small presentation-only depth offsets do not affect range or create lanes; clamp movement against nearest opposing body",
    "proof_status": "NOT_IMPLEMENTED_OR_TESTED"
  },
  "player_mode": "SINGLE_PLAYER_OFFLINE",
  "workflow_version": "WF002_PLACEHOLDER_FIRST",
  "source_package": "OLW-SOURCE-1.0.0"
}
